[
  {
    "name": "Type 2",
    "otherNames": ["IEC 62196", "Mennekes"],
    "current": ["DC", "AC single-phase", "AC three-phase"],
    "maxCurrent": 300,
    "maxVoltage": 480
  },
  {
    "name": "CCS Combo 2",
    "otherNames": ["Combo CSS EU"],
    "current": ["DC"],
    "maxCurrent": 200,
    "maxVoltage": 500
  }
]
